claim_id,strength,allowed_wording,evidence,limitation
C1,strong within retained two-seed experiment,"At the matched budget, ADA improved FID relative to noaug in both retained random conditions.",evidence/experiment_manifest.csv (E1/E1b versus E2/E2b); results/analysis/seed_aggregate.csv,n=2 conditions; no statistical significance claim.
C2,bounded repeated observation,"Under the fixed 1500 kimg image-exposure budget, the retained 50k conditions did not show worse FID than their 100k counterparts.",evidence/experiment_manifest.csv (E1/E1b and E4/E4b); results/analysis/seed_aggregate.csv,50k sees more equivalent epochs; E4/E4b also use different deterministically sampled subsets. Do not claim less data is better.
C3,exploratory single-seed result,Fixed p=0.2 produced the highest precision and lowest recall among the matched-budget seed=42 groups.,evidence/experiment_manifest.csv (E3),No second seed; do not generalize beyond this experiment.
C4,exploratory single-seed result,ADA target=0.4 had the best single-seed FID/KID in the retained matched-budget matrix.,evidence/experiment_manifest.csv (E5),No second seed; do not call target=0.4 universally optimal.
C5,scoped visual observation,Watermark-like contamination is reproduced in retained generated samples and persists through part of the interpolation trajectory.,evidence/visual/watermark_annotations.csv; evidence/visual/interpolation_watermark_audit.csv; evidence/figures/watermark_trajectory.png,"This is evidence of learned contamination, not proof that a specific training image was memorized."
C6,scoped nearest-neighbor audit,"In the current eight-sample Inception-feature nearest-neighbor audit, no near-pixel copy of a training sample was observed.",evidence/nearest_neighbor_audit.md; results/nn/e1-final/neighbors.csv; results/nn/e1-final/nn_seed*.png,Eight generated samples and one feature space cannot establish the absence of memorization for all outputs.
C7,direct protocol evidence,Each formal training run used two GPUs; four- and six-GPU machines were used to schedule multiple independent two-GPU runs in parallel.,evidence/experiment_manifest.csv; configs/baseline/*.json; scripts/run_p2_parallel.sh; scripts/run_p2_seed1.sh,Do not describe a single model as four- or six-GPU training.
